{
  "api_version": "experiments.fips.network/qualification-atlas/v1alpha1",
  "atlas_id": "9b8ab65ea994b4d52feda1b67161a64694d1504ac3edbe3d6ed96a8492882121",
  "fips_commit": "80c956a6fdb85dde1450969a21891c1158e43267",
  "generated_by": "fips-atlas/0.1.0 deterministic qualification models",
  "families": [
    {
      "contract": {
        "id": "root-ratchet",
        "title": "Descending-Minimum Root Ratchet",
        "campaign_source": "examples/root-ratchet.yaml",
        "normative_schema": "experiments.fips.network/v1alpha1",
        "dimensions": [
          "scale",
          "depth",
          "arrival cadence",
          "attachment",
          "transport",
          "resource profile"
        ],
        "boundary_matrix": [
          {
            "name": "debounce cadence",
            "values": [
              "499ms",
              "500ms",
              "501ms"
            ],
            "reason": "coalescing changes at the 500 ms inclusive edge"
          },
          {
            "name": "scale representation",
            "values": [
              "1000",
              "1000000",
              "1000000000"
            ],
            "reason": "individual, aggregate, and cohort boundaries"
          }
        ],
        "assertions": [
          "minimum-root agreement",
          "no forwarding loops",
          "tree lifecycle reconciliation",
          "data-plane progress"
        ],
        "report_recipe": [
          "root wave by depth",
          "causal TreeAnnounce funnel",
          "control bytes per arrival",
          "baseline versus root dampening"
        ],
        "resource_budget": {
          "maximum_individual_nodes": 1000000,
          "maximum_events": 1000000,
          "maximum_memory_bytes": 4294967296,
          "maximum_wall_time_seconds": 600,
          "larger_scale_mode": "cohort or hybrid with explicit uncertainty"
        },
        "fidelity": {
          "supported": [
            "semantic-exact individual",
            "cohort",
            "hybrid sampled-exact",
            "executable-codec wire"
          ],
          "unsupported": [
            "individual representation at one billion nodes"
          ],
          "calibration": "fixtures/m4/calibration.json; family boundary evidence is deterministic"
        }
      },
      "baseline": [
        {
          "name": "control-amplification",
          "value": "1000000",
          "unit": "ppm",
          "fidelity": "deterministic-model",
          "evidence": "qualification/baseline"
        }
      ],
      "discovered_boundary": {
        "id": "debounce-500ms",
        "below": {
          "name": "constructed-announcements",
          "value": "2",
          "unit": "frames per peer",
          "fidelity": "deterministic-model",
          "evidence": "boundary-matrix/below"
        },
        "at": {
          "name": "constructed-announcements",
          "value": "1",
          "unit": "frames per peer",
          "fidelity": "deterministic-model",
          "evidence": "boundary-matrix/at"
        },
        "above": {
          "name": "constructed-announcements",
          "value": "2",
          "unit": "frames per peer",
          "fidelity": "deterministic-model",
          "evidence": "boundary-matrix/above"
        },
        "conclusion": "500 ms coalesces the pending request; 501 ms begins a second construction window"
      },
      "variant_comparison": {
        "baseline": {
          "name": "control-amplification",
          "value": "1000000",
          "unit": "ppm",
          "fidelity": "deterministic-model",
          "evidence": "qualification/baseline"
        },
        "variant_id": "root-dampening-v1",
        "variant": {
          "name": "control-amplification",
          "value": "620000",
          "unit": "ppm",
          "fidelity": "deterministic-model",
          "evidence": "qualification/variant"
        },
        "relative_change_ppm": -380000,
        "causal_explanation": "dampening suppresses discretionary intermediate-root announcements while preserving final adoption"
      },
      "assertions": [
        {
          "id": "minimum-root-agreement",
          "outcome": "pass",
          "evidence": "qualification/root-ratchet/minimum-root-agreement"
        },
        {
          "id": "no-forwarding-loops",
          "outcome": "pass",
          "evidence": "qualification/root-ratchet/no-forwarding-loops"
        },
        {
          "id": "tree-lifecycle-reconciliation",
          "outcome": "pass",
          "evidence": "qualification/root-ratchet/tree-lifecycle-reconciliation"
        },
        {
          "id": "data-plane-progress",
          "outcome": "pass",
          "evidence": "qualification/root-ratchet/data-plane-progress"
        }
      ],
      "minimized_reproduction": {
        "id": "root-ratchet-boundary-min",
        "normalized_plan": {
          "api_version": "experiments.fips.network/normalized-plan/v1alpha1",
          "campaign_sha256": "7a17a433a4e6dbd971c25b6ab7a034961ec6735aeefb8a8227efca10a8f61cb7",
          "campaign": {
            "accounting": {
              "causal_lineage": true,
              "network_overhead": "configured",
              "reconcile_serialized_frames": true,
              "transport_overhead": true
            },
            "adversaries": {
              "actions": [
                "bounded-root-grinding",
                "strategic-attachment"
              ],
              "budgets": {
                "identities": {
                  "values": [
                    1,
                    10,
                    1000
                  ]
                },
                "operations": {
                  "values": [
                    1,
                    1000,
                    1000000
                  ]
                }
              },
              "mode": "authenticated-protocol-valid"
            },
            "apiVersion": "experiments.fips.network/v1alpha1",
            "assertions": [
              {
                "eventually": {
                  "after_input_quiescence": {
                    "nanoseconds": 30000000000
                  },
                  "condition": "all_connected_nodes_agree_on_minimum_root"
                }
              },
              {
                "always": {
                  "condition": "no_forwarding_loops"
                }
              },
              {
                "always": {
                  "condition": "accepted_ancestry_is_valid"
                }
              },
              {
                "always": {
                  "condition": "per_peer_announcements_obey_debounce"
                }
              },
              {
                "eventually": {
                  "condition": "control_queues_return_to_baseline"
                }
              },
              {
                "eventually": {
                  "condition": "data_plane_makes_progress"
                }
              },
              {
                "reconcile": {
                  "condition": "measured_bytes_equal_serialized_frames"
                }
              },
              {
                "deterministic": {
                  "condition": "same_seed_same_event_order_and_result"
                }
              }
            ],
            "engine": {
              "deterministic": true,
              "modes": {
                "values": [
                  "cohort-hybrid",
                  "compact-discrete-event"
                ]
              },
              "variant": "fips-80c956a-baseline"
            },
            "events": [
              {
                "action": "introduce-lower-root-identities",
                "id": "descending-root-arrivals",
                "parameters": {
                  "source": "identities.arrivals"
                }
              }
            ],
            "fidelity": {
              "billion_node_representation": "cohort-with-sampled-exact-regions",
              "bloom": {
                "values": [
                  "cohort-fpr",
                  "exact-bits",
                  "occupancy",
                  "sampled-exact"
                ]
              },
              "crypto": {
                "values": [
                  "adversarial-budget",
                  "calibrated-cost",
                  "operation-count"
                ]
              },
              "protocol": "semantic-exact",
              "serialization": "executable-codec"
            },
            "identities": {
              "arrivals": {
                "address_policy": "strictly-lower-than-current-root",
                "attachment": {
                  "values": [
                    "articulation-point",
                    "current-root",
                    "highest-degree",
                    "random-leaf"
                  ]
                },
                "attacker_budget": {
                  "mode": {
                    "values": [
                      "bounded",
                      "calibrated-cost",
                      "free-input",
                      "operation-count"
                    ]
                  }
                },
                "count": {
                  "values": [
                    1,
                    10,
                    100,
                    1000
                  ]
                },
                "schedule": {
                  "interval": {
                    "values": [
                      {
                        "nanoseconds": 0
                      },
                      {
                        "nanoseconds": 10000000000
                      },
                      {
                        "nanoseconds": 1000000000
                      },
                      {
                        "nanoseconds": 100000000
                      },
                      {
                        "nanoseconds": 10000000